#CODE;ENGLISH;x;;;
ironborn_reaving;Отправиться в рейд;x;;;
ironborn_reaving_desc;Заплатить железную цену и организовать поход за Узкое Море, чтобы устроить грабеж и добыть себе богатство. Вам потребуется назначить §Yрегента§!, который будет править во время вашего отсутствия.;x;;;
on_reaving;В рейде;x;;;
on_reaving_desc;Этот персонаж уплыл в далекие страны, чтобы заплатить железную цену за новые богатства;x;;;
TOOLTIPINVITEREAVING;Железнорожденный при вашем дворе и семье был приглашен в рейд\n;x;;;
EVTDESCraid_events.1;Кто станет жертвой нашего гнева? Где мы будем грабить, жечь и убивать, чтобы заплатить железную цену?;x;;;
EVTOPTAraid_events.1;Спорные Земли готовы к жатве;x;;;
EVTOPTBraid_events.1;Северный Эссос примет гостей;x;;;
EVTOPTCraid_events.1;Жители Летних Островов слабы;x;;;
EVTOPTDraid_events.1;Мы можем найти много добычи в Заливе Работорговцев;x;;;
EVTDESCraid_events.2;[Root.GetFirstNameWithDynasty], я приглашаю вас заплатить железную цену, присоединившись ко мне в моем рейде в моря Спорных Земель. Там, следуя пути наших предков и Старому Закону, мы захватим много морских жен и золота!\n\n Ваш[From.GetEndA],\n[From.GetFirstNameWithDynasty];x;;;
EVTDESCraid_events.2B;[Root.GetFirstNameWithDynasty], я приглашаю вас заплатить железную цену, присоединившись ко мне в моем рейде на север и в Студеное Море. Там, следуя пути наших предков и Старому Закону, мы нападем на корабли Лората и Иббена, захватим много морских жен и золота!\n\n Ваш[From.GetEndA],\n[From.GetFirstNameWithDynasty];x;;;
EVTDESCraid_events.2C;[Root.GetFirstNameWithDynasty], я приглашаю вас заплатить железную цену, присоединившись ко мне в моем рейде на юг и на Летнее море. Там, следуя пути наших предков и Старому Закону, мы нападем на слабых летних островитян, захватим много морских жен и золота!\n\n Ваш[From.GetEndA],\n[From.GetFirstNameWithDynasty];x;;;
EVTDESCraid_events.2D;[Root.GetFirstNameWithDynasty], я приглашаю вас заплатить железную цену, присоединившись ко мне в моем рейде далеко на восток, в Залив Работорговцев. Там, следуя пути наших предков и Старому Закону, мы захватим много морских жен и золота!\n\n Ваш[From.GetEndA],\n[From.GetFirstNameWithDynasty];x;;;
EVTOPTAraid_events.2;Я долж[GetNaEn] последовать за ним!;x;;;
EVTOPTBraid_events.2;Рейды не для меня…;x;;;
EVTOPTCraid_events.2;Я никогда не стану налетчиком!;x;;;
TOOLTIPREAVINGDISPUTEDLANDS;[From.GetFirstNameWithDynasty] собрал[From.GetEndA] рейд и вы присоединились к набегу на Спорные Земли. Вам потребуется регент на время вашего отсутствия.\n;x;;;
TOOLTIPREAVINGNORTHESSOS;[From.GetFirstNameWithDynasty] собрал[From.GetEndA] рейд и вы присоединились к набегу на Северный Эссос. Вам потребуется регент на время вашего отсутствия.\n;x;;;
TOOLTIPREAVINGSUMMERSEA;[From.GetFirstNameWithDynasty] собрал[From.GetEndA] рейд и вы присоединились к набегу на острова Летнего Моря. Вам потребуется регент на время вашего отсутствия.\n;x;;;
TOOLTIPREAVINGSLAVERSBAY;[From.GetFirstNameWithDynasty] собрал[From.GetEndA] рейд и вы присоединились к набегу на Залив Работорговцев. Вам потребуется регент на время вашего отсутствия.\n;x;;;
EVTDESCraid_events.3;Клинки наточены и паруса ваших драккаров наполнены ветром. Пора отправляться в даль, за Узкое Море, чтобы заплатить железную цену!;x;;;
EVTOPTAraid_events.3;Это будет прибыльно.;x;;;
EVTOPTBraid_events.3;Война сделала это невозможным.;x;;;
EVTDESCraid_events.4;Рейд подошел к концу. Мы вернулись из-за далеких морей, набрав богатства и морских жен, за которых заплатили железную цену. Следуя пути предков, мы пролили реки крови, заставив мир содрогнуться от ужаса. Дома нас ждет много славы, наши имена останутся в легендах!;x;;;
EVTOPTAraid_events.4;Мы настоящие Железнорожденные!;x;;;
EVTDESCraid_events.5;Рейд, который собрал[From.GetEndA] [From.GetFirstNameWithDynasty], закончился. Мы вернулись домой захватив богатую добычу и много морских жен. ;x;;;
EVTDESCraid_events.6;Из-за войны, рейд, который собирал[From.GetEndA] [From.GetFirstNameWithDynasty], отменился.;x;;;
EVTOPTAraid_events.6;В следующем году;x;;;
opinion_on_reaving;В рейде;x;;;
opinion_went_reaving;Покинуть рейд;x;;;
EVTDESCraid_events.7;Разведчик обнаружил рыбацкую деревню, в которой мы сможем найти много добычи и женщин.;x;;;
EVTOPTAraid_events.7;Пусть начнется грабеж!;x;;;
EVTDESCraid_events.9;Нападение прошло успешно. Стоны умирающих мужчин, вопли насилуемых женщин и треск пламени звучали лучше трелей менестреля в ушах разбойников. Мы получили много чести и добычи сегодня!;x;;;
EVTOPTAraid_events.9;Все боятся железнорожденных!;x;;;
EVTDESCraid_events.10;Битва была тяжелой и мы потеряли сегодня много людей. Но никто не сможет остановить Железнорожденного, вознамерившегося заплатить железную цену. Мы забрали все золото и женщин у этих слабаков.;x;;;
EVTOPTAraid_events.10;Успешный рейд;x;;;
EVTDESCraid_events.11;Эти люди, которые сеют много больше нас, победили. Мы высадились на пляже, но были сброшены обратно в море. Сегодня мы проиграли.;x;;;
EVTOPTAraid_events.11;Нужно отступать…;x;;;
opinion_failed_raid;Набег провалился…;x;;;
EVTDESCraid_events.12;Набег окончился полным провалом. Люди с полей оказались сильнее, чем мы полагали. Многие из наших людей пали. Вместо богатства и женщин мы получили бесчестие...;x;;;
EVTOPTAraid_events.12;Мы не достойны быть Железнорожденными;x;;;
EVTDESCraid_events.13;Деревня была подвергнута грабежу, и нападение, которое возглавлял[From.GetEndA] [From.GetFirstNameWithDynasty] прошло удачно. Стоны умирающих мужчин, вопли насилуемых женщин и треск пламени звучали лучше трелей менестреля в ушах разбойников. Мы получили много чести и добычи сегодня!;x;;;
EVTDESCraid_events.14;[From.GetFirstNameWithDynasty] принял[From.GetEndA] решение напасть, и это вызвало кровопролитный бой, в котором мы потеряли много храбрецов. Но никто не сможет остановить Железнорожденного, вознамерившегося заплатить железную цену. Мы забрали все золото и женщин у этих слабаков.;x;;;
EVTDESCraid_events.15;Большинство считало, что рейд, который собрал[From.GetEndA] [From.GetFirstNameWithDynasty], казался легким, но мы недооценили противника... Мы высадились на пляже, но были сброшены обратно в море. Сегодня мы проиграли.;x;;;
EVTDESCraid_events.16;Рейд персонажа [From.GetFirstNameWithDynasty] совершенно провалился. Люди с полей оказались сильнее, чем мы полагали. Многие из наших людей пали. Вместо богатства и женщин мы получили бесчестие…;x;;;
opinion_sucessful_raid;Успешный набег;x;;;
opinion_salt_wife;Морская Жена;x;;;
EVTDESCraid_events.17;Сегодня я доказал, что я истинный сын Железных Островов - я захватил Морскую Жену! Что мне с ней делать?;x;;;
EVTOPTAraid_events.17;Заберу ее домой, что бы она ублажала меня и рожала детей;x;;;
EVTOPTBraid_events.17;Убейте ее, она мне не нравится…;x;;;
EVTDESCraid_events.18;[From.GetFirstNameWithDynasty] доказал свое право называться железнорожденным, когда захватил морскую жену.;x;;;
EVTOPTAraid_events.18;Славься!;x;;;
salt_wife;Морская жена;x;;;
salt_wife_desc;Эта женщина - чья-то морская жена, захваченная в рейде.;x;;;
EVTDESCraid_events.20;Местный патруль напал на нас, когда мы грабили побережье. Мы - [Root.Culture.GetName]ые, и вступили в схватку, их командир кинулся прямо на меня...;x;;;
EVTOPTAraid_events.20;В бой!!!;x;;;
EVTOPTBraid_events.20;Я убираюсь отсюда;x;;;
EVTDESCraid_events.22;Патруль, который возглавлял [FromFrom.GetFirstNameWithDynasty], напал на нас, когда мы грабили побережье. Мы перебили их всех с легкостью, но львиную долю славы получил [From.GetFirstNameWithDynasty], который победил противника по имени [FromFrom.GetFirstName] в дуэли, размахивая мечом в самой гуще битвы. Теперь он ожидает награды.;x;;;
opinion_rewarded_reaving;Наградить;x;;;
opinion_denied_rewarded_reaving;Обойдется;x;;;
EVTDESCraid_events.23;Патруль, который возглавлял [From.GetFirstNameWithDynasty], внезапно напал на нас, когда мы пировали и развлекались с новыми морскими женами на пепелище очередной деревушки. Мы потеряли многих людей в бойне, [FromFrom.GetFirstNameWithDynasty] был среди них. Он проиграл противнику по имени [From.GetFirstName] в поединке. Но мы выжили и мы вернемся.;x;;;
EVTOPTAraid_events.22;Ему повезло;x;;;
EVTOPTBraid_events.22;Хорошо, дайте ему часть добычи;x;;;
EVTOPTCraid_events.22;Награда? Честь не в деньгах;x;;;
EVTOPTAraid_events.23;Он промахнулся;x;;;
TOOLTIPREAVINGDUEL;Дуэль будет с местным мастером над оружием\n;x;;;
TOOLTIPREAVINGDUELVS;Вы получили §Yвалирийский меч§!, которым владел[From.GetEndA] [From.GetFirstNameWithDynasty] в свое владение\n;x;;;
EVTDESCraid_events.24;Во время прошлой атаки один из противников смог ранить меня. Но железнорожеднные смеются при слове 'рана', не так ли?;x;;;
EVTOPTAraid_events.24;Да, я должен продолжать грабеж!;x;;;
EVTOPTBraid_events.24;Думаю мне стоит вернуться домой;x;;;
EVTDESCraid_events.25;Во время последнего боя [From.GetFirstNameWithDynasty] был[From.GetEndA] ранен[From.GetEndA] вражеским бойцом. Но, как истинный железнорожденный, он[From.GetEndA] решил[From.GetEndA] остаться с нашим отрядом.;x;;;
EVTOPTAraid_events.25;Славься!;x;;;
EVTDESCraid_events.26;Во время последнего боя [From.GetFirstNameWithDynasty] был[From.GetEndA] ранен[From.GetEndA] вражеским бойцом. Он[From.GetEndA] решил[From.GetEndA] вернуться домой.;x;;;
EVTOPTAraid_events.26;Это трусость;x;;;
EVTDESCraid_events.27;Во время последнего боя был[From.GetEndA] ранен[From.GetEndA] вражеским бойцом наш командир, [From.GetFirstNameWithDynasty]. Он[From.GetEndA] решил[From.GetEndA] вернуться домой и забрал[From.GetEndA] всех своих людей с собой, чего они ни могут одобрить.;x;;;
EVTOPTAraid_events.27;Трус!;x;;;
EVTDESCraid_events.28;Во время последнего боя я был[From.GetEndA] серьезно ранен[From.GetEndA], но прежде, чем это случилось я порубил[From.GetEndA] в капусту не меньше сотни противников!;x;;;
EVTOPTAraid_events.28;Я все еще охочусь за добычей!;x;;;
EVTOPTBraid_events.24;Я должен вернуться домой;x;;;
EVTDESCraid_events.29;Эта битва стала моей последней. Я был[From.GetEndA] сражен[From.GetEndA], чтобы никогда не подняться вновь. Но я умер[From.GetNoneE], как истинный железнорожденный, соблюдающий Старый Закона;x;;;
EVTOPTBraid_events.29;То, что мертво, умереть не может.;x;;;
EVTDESCraid_events.30;Как истинный сын Железных Островов, [From.GetFirstNameWithDynasty] пал, окруженный врагами, во время этой битвы. Мы должны почтить его память, продолжая набег и проливая кровь!;x;;;
EVTDESCraid_events.31;Как истинный сын Железных Островов, наш командир, [From.GetFirstNameWithDynasty], пал, окруженный врагами, во время этой битвы. Наш рейд окончен, но мы будем чтить его память, продолжая следовать Старому Закону!;x;;;
EVTDESCraid_events.32;Наши драккары заметили небольшой торговый флот на горизонте. Если мы заплатим железную цену за их груз, то получим много золота и драгоценностей.;x;;;
EVTOPTAraid_events.32;Вперед!;x;;;
EVTOPTBraid_events.32;Слишком рискованно;x;;;
opinion_reaver_no_attack;Не нападать;x;;;
EVTDESCraid_events.33;Мы даже не заметили, как разделались с вражеским экипажем. Трюмы кораблей ломились от товаров и золота. Вот почему мы чтим Старый Закон!;x;;;
EVTOPTAraid_events.33;Победа!;x;;;
EVTDESCraid_events.34;Торговые корабли были на удивление хорошо защищены. Мы потеряли много людей, беря их на абордаж, а так же несколько драккаров пошли ко дну. Но в конце концов не осталось никого, кто мог бы сопротивляться нам.;x;;;
EVTOPTAraid_events.34;Цена была заплачена;x;;;
EVTDESCraid_events.35;Вражеские купцы были слишком хорошо вооружены для нас. Они так модернизировали свои корабли, что мы даже приблизиться к ним не смогли. Мы потеряли много людей, но мы еще вернемся, что бы заплатить нашу железную цену.;x;;;
EVTOPTAraid_events.35;До следующего рейда;x;;;
EVTDESCraid_events.36;Под треск наших драккаров и вопли наших людей, мы уходили с поля боя, что бы сохранить хотя бы часть людей. Чертовы купцы вооружились до зубов и нам нечего было им противопоставить. Этот день стал днем позора для нас.;x;;;
EVTOPTAraid_events.36;Мы еще вернемся!;x;;;
EVTDESCraid_events.37;[From.GetFirstNameWithDynasty] решил[From.GetEndA] напасть на купеческую флотилию. Мы даже не заметили, как разделались с вражеским экипажем. Трюмы кораблей ломились от товаров и золота. Вот почему мы чтим Старый Закон!;x;;;
EVTDESCraid_events.38;[From.GetFirstNameWithDynasty] решил[From.GetEndA] напасть на купеческую флотилию. Торговые корабли были на удивление хорошо защищены. Мы потеряли много людей, беря их на абордаж, а так же несколько драккаров пошли ко дну. Но в конце концов не осталось никого, кто мог бы сопротивляться нам.;x;;;
EVTDESCraid_events.39;[From.GetFirstNameWithDynasty] решил[From.GetEndA] напасть на купеческую флотилию. Вражеские купцы были слишком хорошо вооружены для нас. Они так модернизировали свои корабли, что мы даже приблизиться к ним не смогли. Мы потеряли много людей, но мы еще вернемся, что бы заплатить нашу железную цену.;x;;;
EVTDESCraid_events.40;[From.GetFirstNameWithDynasty] решил[From.GetEndA] напасть на купеческую флотилию. Под треск наших дракаров и вопли наших людей, мы уходили с поля боя, что бы сохранить хотя бы часть людей. Чертовы купцы вооружились до зубов и нам нечего было им противопоставить. Этот день стал днем позора для нас.;x;;;
EVTDESCraid_events.41;В ходе битвы я увидел[From.GetEndA] человека с мечом из валлирийской стали в руке. У него не было шансов в бою против железнорожденного, и он пал от моей руки. Теперь я обладаю этим велечиственным клинком, во имя вечной славы дома [Root.GetOnlyDynastyName]!;x;;;
EVTOPTAraid_events.41;Прекрасное оружие!;x;;;
EVTDESCraid_events.42;В ходе битвы [From.GetFirstNameWithDynasty] увидел[From.GetEndA] человека с мечом из валлирийской стали в руке. У него не было шансов в бою против железнорожденного, и он пал от его руки. Теперь [From.GetFirstName] владеет этим клинком, во славу своего дома.;x;;;
EVTDESCraid_events.43;Один из моих разбойников стал прекрасным спутником. У нас с ним за плечами чертова уйма походов и битв, мы с ним не раз, стоя плечом к плечу, смотрели в глаза смерти и убивали врагов. Там, где мы с ним проходили, оставались лишь трупы и пепел.;x;;;
EVTOPTAraid_events.43;Мы будем помнить эти времена до конца дней;x;;;
EVTTOOLTIPraid_events.44;стал вашим другом;x;;;
EVTDESCraid_events.44;[From.GetFirstNameWithDynasty] стал прекрасным спутником. У нас с ним за плечами чертова уйма походов и битв, мы с ним не раз, стоя плечом к плечу, смотрели в глаза смерти и убивали врагов. Там, где мы с ним проходили, оставались лишь трупы и пепел.;x;;;
EVTDESCraid_events.45;Мне никогда не нравился один из моих разбойников, и этот рейд не улучшил ситуации. Постоянные гонки в том, кто изнасиловал больше женщин и убил мужчин, только разожгли дух остервенелого соперничества.;x;;;
EVTOPTAraid_events.45;Он невыносим!;x;;;
EVTTOOLTIPraid_events.46;станет вашим соперником;x;;;
EVTDESCraid_events.46;Мне никогда не нравился [From.GetFirstNameWithDynasty], и этот рейд не улучшил ситуации. Постоянные гонки в том, кто изнасиловал больше женщин и убил мужчин, только разожгли дух остервенелого соперничества.;x;;;
EVTDESCraid_events.47;После долгих дней грабежа, люди отдыхают, распивая крепкие напитки, припасенные в трюмах наших кораблей. Один из разбойников пытается доказать, что он здесь лучший, и мои люди настаивают на том, что бы я вызвал его на танец с топориками...;x;;;
EVTOPTAraid_events.47;Мне нет равных! Я вызываю его!;x;;;
EVTOPTBraid_events.47;Я выпил слишком много, что бы танцевать;x;;;
EVTDESCraid_events.48;Мы отдыхаем после долгого дня грабежа и насилия, и я доказываю, что я лучший железнорожденный, который может убить, изнасиловать и выпить больше всех остальных! [From.GetFirstNameWithDynasty] несогласен и вызывает меня на танец с топориками, чтобы доказать обратное!;x;;;
EVTOPTAraid_events.48;Я согласен!;x;;;
EVTTOOLTIPraid_events.48;вызван на танец с топориками;x;;;
TOOLTIPFINGERDANCEENSUES;[From.GetFirstNameWithDynasty] будет противником в Танце\n;x;;;
EVTDESCraid_events.50;Несмотря на все свои бравады, [From.GetFirstNameWithDynasty] струсил. Он не принял вашего вызова на танец.;x;;;
EVTOPTAraid_events.50;Я истинный железнорожденный!;x;;;
EVTDESCraid_events.51;[FromFrom.GetFirstNameWithDynasty] принял вызов и должен пожалеть об этом! Топорики замерцали в воздухе, и я с грацией уклонялся в стороны, ловил их и снова подкидывал. [From.GetTitledFirstNameNoRegnal] не выдержал и сдался после того, как потерял несколько пальцев.;x;;;
EVTOPTAraid_events.51;Никто не танцует лучше меня!;x;;;
