#CODE;ENGLISH;x;;;
EVTDESCraid_events.52;Мое решение вызвать моего соперника [From.GetFirstNameWithDynasty] на соревнование было недальновидным. Топорики мерцали все чаще и быстрее, и, после потери нескольких пальцев, я был вынужден отступить.;x;;;
EVTOPTAraid_events.52;Он был слишком хорош!;x;;;
EVTDESCraid_events.53;После того, как [FromFrom.GetFirstNameWithDynasty] принял мой вызов, состоялся танец. Мы искусно и смело уклонялись от множества топориков, не получив не единой серьезной раны и не потеряв пальцев! Все согласились, что это было хорошее состязание!;x;;;
EVTOPTAraid_events.53;Мы должны повторить это!;x;;;
EVTDESCraid_events.54;После того, как [From.GetFirstNameWithDynasty] бросил мне вызов, состоялся танец. Мы искусно и смело уклонялись от множества топориков, не получив не единой серьезной раны и не потеряв пальцеы! Все согласились, что это было хорошее состязание!;x;;;
EVTDESCraid_events.55;[FromFrom.GetFirstNameWithDynasty] не просто так сотрясал воздух. Он принял мой вызов и пляска началась. Топорики мерцали все чаще и быстрее, и, после потери нескольких пальцев, я был вынужден отступить.;x;;;
EVTOPTAraid_events.55;Люди стали меньше меня уважать;x;;;
EVTDESCraid_events.56;Я принял вызов, который бросил [From.GetFirstNameWithDynasty] и заставлю его об этом пожалеть! Топорики замерцали в воздухе, и я с грацией уклонялся в стороны, ловил их и снова подкидывал. [From.GetTitledFirstNameNoRegnal] не выдержал и сдался после того, как потерял несколько пальцев.;x;;;
EVTDESCraid_events.57;Люди отдыхали после хорошего грабежа, когда [FromFrom.GetFirstNameWithDynasty] вызвал персонажа [From.GetFirstNameWithDynasty], который хвастался своими подвигами, на танец с топориками! [FromFrom.GetFirstName] был намного лучше, и грациозно уклонялся от лезвий. [From.GetFirstName] сдался, после потери нескольких пальцев;x;;;
EVTOPTAraid_events.57;Это было хорошее зрелище;x;;;
EVTDESCraid_events.58;Люди отдыхали после хорошего грабежа, когда [FromFrom.GetFirstNameWithDynasty] вызвал персонажа [From.GetFirstNameWithDynasty], который хватался своими подвигами, на танец с топориками! Это было прекрасное представление, оба противника были достойны друг друга! Все согласились с этим.;x;;;
EVTOPTAraid_events.58;Как истинные железнорожденные!;x;;;
EVTDESCraid_events.59;Люди отдыхали после хорошего грабежа, когда [FromFrom.GetFirstNameWithDynasty] вызвал персонажа [From.GetFirstNameWithDynasty], который хватался своими подвигами, на танец с топориками! [FromFrom.GetFirstName] проиграл в этом соревновании, в то время как [From.GetFirstName] уклонялся от топориков более ловко. [FromFrom.GetFirstName] сдался после потери нескольких пальцев.;x;;;
EVTDESCraid_events.60;Утонувший Бог, пощади нас! Наши драккары подверглись нападению кракена! Все считали, что они лишь миф Века Героев, но нам он сейчас кажется таким настоящим!;x;;;
EVTOPTAraid_events.60;Железнорожденные! К оружию!;x;;;
TOOLTIPKRAKENDEFEATED;Кракен убит\n;x;;;
TOOLTIPKRAKENWINS;Кракен сокрушил наши корабли\n;x;;;
EVTDESCraid_events.61;Победа за нами! Кракен был могуч, но не так, как мы. Чудовище было убито, а корабли спасены. Об этом дне будут слагать легенды!;x;;;
EVTOPTAraid_events.61;Даже Кракены склоняются перед нами!;x;;;
EVTDESCraid_events.62;Кракен разнес наш флот в щепки и отправил нас пировать в подводные чертоги утонувшего бога.;x;;;
EVTOPTAraid_events.62;То, что мертво, умереть не может.;x;;;
EVTDESCraid_events.63;В открытом море наши корабли, которые возглавлял [From.GetFirstNameWithDynasty], подверглись нападению огромного Кракена, но он не был так хорош, как железнорожденные, которые отправили чудовище назад к Утонывшему Богу!;x;;;
EVTDESCraid_events.64;Утонувший Бог, пощади нас! Наш флот, которые возглавлял [From.GetFirstNameWithDynasty] наткнулся на огромного Кракена, который сокрушил все корабли! Он был силшком большой, слишком сильный. Все железнорожденные, бывшие на кораблях, отправились пировать в подводные чертоги Утонувшего Бога. ;x;;;
EVTDESCraid_events.66;[From.GetName] отдалась нашему отряду разбойников. Может мне стоит сделать ее своей морской женой?;x;;;
EVTDESCraid_events.66B;[From.GetName] отдалась нашему отряду разбойников. Может мне стоит забрать девушку себе?;x;;;
EVTDESCraid_events.66C;[From.GetName] отдался нашему отряду разбойников. Может мне стоит забрать парня себе?;x;;;
EVTDESCraid_events.66D;[From.GetName] отдался нашему отряду разбойников. Может мне стоит забрать морского мужа себе?;x;;;
EVTOPTAraid_events.66;[salt_wife_1.GetSheHeCap] будет хорош[salt_wife_1.GetEyIm] морск[salt_wife_1.GetOyIm] [salt_wife_1.GetHusbandWifeINS];x;;;
EVTOPTBraid_events.66;Мне нравится смотреть на н[salt_wife_2.GetHerHis];x;;;
EVTOPTCraid_events.66;Отправить [salt_wife_3.GetHerHis] на мой корабль;x;;;
EVTOPTDraid_events.66;Мне не нужны морские жены;x;;;
EVTDESCraid_events.660;[FromFrom.GetName] пал, и [From.GetTitledFirstName] объявил, что я - его [Root.GetConsortName]!;x;;;
EVTDESCraid_events.660B;[FromFrom.GetName] пал, и [From.GetTitledFirstName] сделал меня своей наложницей!;x;;;
EVTOPTDraid_events.660;О нет!;x;;;
EVTDESCraid_events.661;После того, как [FromFrom.GetFirstNameWithDynasty] ограбил мой замок, он оскорбил меня: теперь моя [From.GetRootRelation] [From.GetFirstName] - его [FromFrom.GetMyConsortName]!;x;;;
EVTDESCraid_events.661B;После того, как [FromFrom.GetFirstNameWithDynasty] ограбил мой замок, о оскорбил меня: теперь моя  [From.GetRootRelation] [From.GetFirstName] - его [From.GetConsortName]!;x;;;
EVTOPTDraid_events.661;Я отомщу [From.GetHerHim]!;x;;;
EVTDESCraid_events.662;[FromFrom.GetTitledFirstName] доказал своё право называться железнорожденным, когда [FromFrom.GetSheHe] объявил, что [From.GetFirstName] - [FromFrom.GetHerHis] [From.GetMyConsortName].;x;;;
EVTDESCraid_events.662B;[FromFrom.GetTitledFirstName] доказал своё право называться хорошим воином,  когда [FromFrom.GetSheHe] объявил, что [From.GetFirstName] - [FromFrom.GetHerHis] [From.GetConsortName].;x;;;
EVTOPTDraid_events.662;Славься, [FromFrom.GetManWoman]а!;x;;;
EVTDESCraid_events.67;После тщательного обыска замка [FromFrom.GetName], я обнаружил, что один из жителей владеет валлирийским клинком. Вы присвоите этот меч? Они могут не отдать его добровольно...;x;;;
EVTOPTAraid_events.67;Да, я заплачу железную цену!;x;;;
EVTOPTAraid_events.67B;Да, я сделаю его своим!;x;;;
TOOLTIPraid_events.670;[This.GetFirstNameWithDynasty] выслежен;x;;;
EVTOPTBraid_events.675;Нет, мне не нужны блестящие лезвия;x;;;
EVTDESCraid_events.670;[From.GetFirstNameWithDynasty] и [From.GetHerHis] банда грабителей пробили оборону моего замка, и начали безжалостную резню. Через некоторое время, [From.GetSheHe] загнал меня в угол, и желает отнять мой ценный валирийский меч!;x;;;
EVTOPTAraid_events.670;Я умру прежде чем [From.GetSheHe] отберет меч [Root.GetValyrianSword]!;x;;;
TOOLTIPraid_events.672;Вы атакуете персонажа [From.GetFirstNameWithDynasty]...;x;;;
EVTOPTBraid_events.670;Я сдаюсь, пожалуйста, не трогайте меня!;x;;;
TOOLTIPraid_events.671;[From.GetFirstNameWithDynasty] берет меч;x;;;
EVTDESCraid_events.671;[From.GetFirstNameWithDynasty] был обнаружен, затаившись в одной из башен, и с готовностью сдается. [From.GetSheHeCap] опускается на колени перед всеми вашими людьми и предлагает вам [From.GetValyrianSwordHerHis] в обмен на [From.GetHerHis] жизнь.;x;;;
EVTOPTAraid_events.671;Теперь я владею им во имя Дома [Root.GetOnlyDynastyName]!;x;;;
EVTDESCraid_events.672;На вершине стены [From.GetFirstNameWithDynasty], наконец, был загнан в угол. Клинок, который вы желаете, [From.GetValyrianSwordHerHis], покрыт красной кровью налетчиков, которых [From.GetSheHe] сразил, и [From.GetSheHe] понимает, что вы заплатите железную цену, чтобы получить этот меч.;x;;;
EVTDESCraid_events.672B;На вершине стены [From.GetFirstNameWithDynasty], наконец, был загнан в угол. Клинок, который вы желаете, [From.GetValyrianSwordHerHis], покрыт красной кровью рейдеров, которых [From.GetSheHe] сразил, и [From.GetSheHe] понимает, что вы заплатите железную цену, чтобы получить этот меч.;x;;;
EVTOPTAraid_events.672;[From.GetSheHeCap] нужен мне больше, чем причудливый меч;x;;;
EVTDESCraid_events.673;[FromFrom.GetFirstNameWithDynasty] лежит у ваших ног, [FromFrom.GetSheHe] был храбр, нужно признать. Но теперь вы берете свой приз, [From.GetValyrianSwordHerHis].;x;;;
EVTOPTAraid_events.673;Теперь я владею им, во имя Дома [Root.GetOnlyDynastyName]!;x;;;
EVTDESCraid_events.674;[From.GetFirstNameWithDynasty] избил вас почти до смерти. И теперь [From.GetSheHe] утверждает, что [Root.GetValyrianSwordOwned], реликвия вашего дома, по [From.GetHerHis] словам, принадлежит ему, как и вы, в качестве 'трофея'.;x;;;
EVTOPTAraid_events.674;Позор, который я принес;x;;;
EVTDESCraid_events.676;После успешного разграбления замка, [From.GetFirstNameWithDynasty] захватил персонажа [FromFrom.GetFirstNameWithDynasty], который владел грозным мечом из валирийской стали. Поскольку [From.GetSheHe] заплатил железную цену, [From.GetSheHe] потребовал его для себя.;x;;;
EVTDESCraid_events.676B;После успешного разграбления замка, [From.GetFirstNameWithDynasty] захватил персонажа [FromFrom.GetFirstNameWithDynasty], который владел грозным мечом из валирийской стали. [From.GetSheHeCap] потребовал клинок для себя.;x;;;
EVTDESCraid_events.677;[From.GetFirstNameWithDynasty] и [From.GetHerHis] разбойники не смогли с вами справится. Вы и ваши люди прорезали путь сквозь них и бежали из замка. [Root.GetValyrianSwordOwned] все еще в ваших руках.;x;;;
EVTOPTAraid_events.677;Маленькая победа;x;;;
opinion_stole_sword;Украл мой меч;x;;;
EVTDESCraid_events.90;Деревня созрела для грабежа, и нападение налётчика [From.GetFirstNameWithDynasty] оказалось весьма успешным. Крики крестьян и треск огня были сладкой музвкой для ушей. В этот день они получили много славы и добычи!;x;;;
EVTDESCraid_events.91;Решение, которое принял [From.GetFirstNameWithDynasty] - напасть на рыбацкую деревню обернулось тяжелой битвой, к счастью, лишь несколько [From.GetHerHis] людей было потеряно. Никто не может противостоять силе железнорожденных, и сегодня они выплатили железную цену,победив и разграбив этих слабых людей.;x;;;
EVTDESCraid_events.92;Большинство считало, что набег на деревню будет простым, но эти люди, которые сеют, оказались сильнее нас. [From.GetHerHisCap] железнорожденным удалось взять небольшую часть деревни, но они были отброшены. Сегодня они не выплатят цену железом.;x;;;
EVTDESCraid_events.93;Нападение налётчика [From.GetFirstNameWithDynasty] на рабацкую деревню обернулось оглушительным провалом, зеленые люди оказались куда сильнее, чем они думали. Много [From.GetHerHis] налетчиков было убито, а [From.GetSheHe] и его железнорожденные опозорены.;x;;;
EVTDESCraid_events.94;[From.GetFirstNameWithDynasty] смело решил напасть на торговые суда, боевая выучка [From.GetHerHis] железнорожденных оказалась на порядок выше. Они затопили их корабли сопровождения, захватили грузы и пленили множество людей. Вот почему мы следуем Старому Закону!;x;;;
EVTDESCraid_events.95;Решение персонажа [From.GetFirstNameWithDynasty] атаковать торговую флотилию казалось легким, но корабли оказались достаточно хорошо защищены. Они потеряли несколько человек и кораблей, но, в тоге, никто не смог противостоять силе железнорожденных, было захвачено много грузов и пленников.;x;;;
EVTDESCraid_events.96;Нападение персонажа [From.GetFirstNameWithDynasty] на торговый флот было безрассудным, поскольку торговцы оказались хорошо вооружены для железнорожденных. Они превосходно оперировали своими кораблями, не позволим налетчикам даже приблизиться к себе. Мы потеряли несколько человек, но мы вернемся, чтобы взять нашу железную цену.;x;;;
EVTDESCraid_events.97;Нападение персонажа [From.GetFirstNameWithDynasty на торговый флот обернулось катастрофоу. Их корабли оказались хорошо вооружены и укомплектованы, [From.GetSheHe] потерял многих людей и вассалов, пытающихся  вернуться на свои корабли. Это позор для железнорожденных.;x;;;
EVTOPTAraid_events.97;Скудоумие;x;;;
EVTDESCraid_events.98;Пока [raiding_target.GetSheHe] был вовлечен в конфликт, мы совершили набег на земли, верные персонажу [raiding_target.GetTitledFirstName] [raiding_target.GetOnlyDynastyName]. [raiding_target.GetSheHeCap], безусловно, будет недоволен этим вопиющим нарушением законов своей земли.;x;;;
EVTOPTAraid_events.98;Пфф, мы Железнорожденные! Мы следуем старому закону!;x;;;
EVTOPTAraid_events.98B;Мне плевать, что они думают!;x;;;
TOOLTIPlootvengeancereturnloot;[From.GetFirstNameWithDynasty] и [From.GetHerHis] налетчики должны вернуть всех похищенных женщин, захваченных рабов и украденные мечи, а также выплатить компенсацию золотом человеку, известному как [Root.GetTitle] [Root.GetFirstNameWithDynasty].\n;x;;;
EVTDESCraid_events.99;[From.GetFirstNameWithDynasty] победил нас на поле битвы, отомстив за разграбление [From.GetHerHis] земель. Теперь мы должны вернуть все награбленное, которое взяли у них...;x;;;
EVTDESCraid_events.99B;[From.GetFirstNameWithDynasty] победил нас на поле битвы, отомстив за разграбление [From.GetHerHis] земель. Теперь мы должны вернуть все награбленное, которое взяли у них...;x;;;
EVTOPTAraid_events.99;Мы поднимемся снова;x;;;
EVTDESCraid_events.100;Я был спасен от этих грязных грабителей. [FromFrom.GetFirstNameWithDynasty], который победил противника по имени [From.GetFirstNameWithDynasty] в поле в качестве мести за грабеж своих земель.;x;;;
EVTOPTAraid_events.100;Теперь я могу идти домой;x;;;
EVTDESCraid_events.101;[FromFrom.GetFirstNameWithDynasty] - действительно слабый лидер, [FromFrom.GetSheHe] был побежден и был вынужден пойти на уступки в качестве возмещения за свой рейд. Теперь я должен вернуть пленника по имени [From.GetFirstName] персонажу [From.Liege.GetTitledFirstNameWithDynastyNoRegnal] в рамках этих условий.;x;;;
EVTOPTAraid_events.101;Как унизительно;x;;;
EVTDESCraid_events.102;Подлый мародер [FromFrom.GetFirstNameWithDynasty] был вынужден согласиться с условиями возмещения. Одно из этих условий в том, что [From.GetRootRelation] [From.GetFirstName] будет возвращен ко мне после его страшного плена.;x;;;
EVTOPTAraid_events.102;[Root.Religion.GetRandomGodName], хвала тебе, за [From.GetHerHis] безопасное возвращение;x;;;
EVTDESCraid_events.103;[From.GetFirstNameWithDynasty] поистине плохой налетчик, [From.GetSheHe] был побежден и вынужден уступить персонажу [FromFrom.GetFirstNameWithDynasty] компенсацию за свой рейд. Теперь я должен вернуть свой ценный валирийский клинок, захваченный во имя славы [Root.GetOnlyDynastyName].;x;;;
EVTOPTAraid_events.103;Это не останется без ответа;x;;;
EVTDESCraid_events.104;Подлый мародер [FromFrom.GetFirstNameWithDynasty] был вынужден уступить и согласился с условиями компенсации. Одно из этих условий в том, что реликвия моих предков, валирийский меч, конфискован у персонажа [From.GetFirstNameWithDynasty] и возвращен Дому [Root.GetOnlyDynastyName].;x;;;
EVTOPTAraid_events.104;Справедливо;x;;;
TOOLTIPlootvengeancereturnlootinvasion;[Root.GetFirstNameWithDynasty] и [Root.GetHerHis] налетчики должны вернуть всех похищенных женщин, захваченных рабов и украденные мечи, а также выплатить компенсацию золотом человеку, известному как [From.GetTitle] [From.GetFirstNameWithDynasty].\n;x;;;
EVTDESCraid_events.399;В прошлом месяце ваш [From.GetRootRelation] [From.GetTitledFirstNameWithDynasty] организовал рейд, рейд, который [From.GetSheHe] направит на побережье Спорных Земель. [From.GetSheHeCap] и [From.GetHerHis] разбойники отправились из области [From.Location.GetName] следовать старому закону.;x;;;
EVTDESCraid_events.399B;В прошлом месяце ваш [From.GetRootRelation] [From.GetTitledFirstNameWithDynasty] организовал рейд, рейд, который [From.GetSheHe] направит на север и в Студеное море, на поски Лоратийских и Иббенийских кораблей. [From.GetSheHeCap] и [From.GetHerHis] разбойники отправились из области [From.Location.GetName] следовать старому закону.;x;;;
EVTDESCraid_events.399C;В прошлом месяце ваш [From.GetRootRelation] [From.GetTitledFirstNameWithDynasty] организовал рейд, рейд, который [From.GetSheHe] направит в воды Летнего моря и Летние острова. [From.GetSheHeCap] и [From.GetHerHis] разбойники отправились из области [From.Location.GetName] следовать старому закону.;x;;;
EVTDESCraid_events.399D;В прошлом месяце ваш [From.GetRootRelation] [From.GetTitledFirstNameWithDynasty] организовал рейд, рейд, который [From.GetSheHe] направит в Залив Работорговцев. [From.GetSheHeCap] и [From.GetHerHis] разбойники отправились из области [From.Location.GetName] следовать старому закону.;x;;;
EVTOPTAraid_events.399;Мы гордимся;x;;;
EVTOPTBraid_events.399;Пусть идут, пока они не нападают на мои земли;x;;;
seek_raiding_redress;Добиваться компенсации за набег;x;;;
seek_raiding_redress_desc;Некотоыре из подданых правителя [Root.GetTitledFirstName] совершили налет на землю [From.PrimaryTitle.GetName]. Поэтому, [From.GetTitledFirstName] может потребовать компенсацию.;x;;;
opinion_demanded_raiding_redress;Требование компенсации за набег;x;;;
TOOLTIPseek_raiding_redressSUBJECT;[Root.GetTitledFirstName] имеет хотя бы одного подданного, который совершил набег на землю [From.GetTitledFirstName], и ему НЕ было уже запрещено совершать набеги на эти земли.\n;x;;;
TOOLTIPraid_events.151;[Root.GetTitledFirstName] получит требование, что те из [Root.GetHerHis] людей, которые совергали рейд на землю [From.PrimaryTitle.GetName] выплатят компенсацию персонажу [From.GetTitledFirstName]. Если они откажутся, то это будет поводом к войне.\nПодданные, совершившие рейд в землю [From.PrimaryTitle.GetName]:;x;;;
