#CODE;ENGLISH;;;;;;;;;;;;;x
EVTDESCvolantis.117;[Root.GetTitledFirstNameWithDynasty], в настоящее время не все триархи находятся в городе, поэтому я не могу принять решение.\n\n С уважением,\n Триарх [FromFrom.GetFirstNameWithDynasty];;;;;;;;;;;;;x
EVTDESCvolantis.21;Полномочия триарха, известного как [From.GetFirstNameWithDynasty] истекли. Как старший член совета, вы должны служить временным триархом до следующих выборов.;;;;;;;;;;;;;x
EVTDESCvolantis.22;Полномочия триарха, известного как [FromFrom.GetFirstNameWithDynasty] истекли и, так как [From.GetFirstNameWithDynasty] является старшим членом совета, он будет назначен временным триархом до следующих выборов.;;;;;;;;;;;;;x
TOOLTIPTRIARCHY;В городе функционирует система триархов, в которой главный триарх правит с двумя соправителями - триархами.\n\n Триархи избираются в ежегодных выборах сроком на один год.\nЕсли Старший Триарх переизбран, он сохраняет пост главы, независимо от количества голосов.\nЕсли он не переизбран, Страшим Триархом становится избранный глава одной из пяти ведущих семей землевладельцев города. Если никто из них не избран - Старший Триарх остается на посту.\nЛюбой свободнорожденный землевладелец может присоединится к партии Слонов или Тигров и будет голосовать на выборах.\nТолько свободнорожденные землевладельцы валирийской крови могут баллотироваться на выборах.\nМладшие триархи имеют следующие коллективные полномочия:\n -Вето на объявление войны (за исключением войн на возвращение исконных земель города)\n -Освобождение заключенных города\n -Назначение в совет города\n -Проведение судебного разбирательства\nМладшие триархи также имеют право распоряжаться частью бюджета города, который им предоставляют после выборов. Они могут пользоваться иммунитетом от Старшего Триарха.\nПосле смерти одного из младших триархов, старший советник принимает полномочия триарха\nПосле смерти Старшего Триарха, один из младших триархов занимает его пост.\n;;;;;;;;;;;;;x
EVTDESCvolantis.118;Как Триарх от партии Слонов, вы представляете интересы купцов и богачей. Влиятельные члены партии подают петицию на строительство и расширение города, чтобы сформировать в городе больший поток товаров и богатства.;;;;;;;;;;;;;x
EVTOPTAvolantis.118;Да, это мой долг перед городом;;;;;;;;;;;;;x
EVTOPTBvolantis.118;Нет, мое богатство только для моей семьи;;;;;;;;;;;;;x
opinion_no_fund_project;Не финансировал партийный проект;;;;;;;;;;;;;x
EVTDESCvolantis.119;Триарх [From.GetFirstNameWithDynasty], член партии Слонов, по просьбе своей партии выделил финансирование на строительный проект в интересах процветания торговли. [From.GetSheHeCap] подписывает соглашение, и строительство будет начато.;;;;;;;;;;;;;x
EVTOPTAvolantis.119;Как щедро;;;;;;;;;;;;;x
EVTDESCvolantis.120;Как Триарх от партии Тигров, вы представляете интересы аристократии и армии города. Влиятельные члены партии подали вам петицию с просьбой начать строительство сооружений для улучшения обороноспособности и военной мощи города.;;;;;;;;;;;;;x
EVTDESCvolantis.121;Триарх [From.GetFirstNameWithDynasty], член партии Тигров, выделяет финансирование на развитие военной инфраструктуры города по просьбе своей партии. Соглашение подписано и строительство начнется немедленно.;;;;;;;;;;;;;x
TOOLTIPTIGERSUNHAPPY;Избиратели партии §YТигров§! будут недовольны этим\n;;;;;;;;;;;;;x
TOOLTIPELEPHANTSUNHAPPY;Избиратели партии §YСлонов§! будут недовольны этим\n;;;;;;;;;;;;;x
EVTOPTA_volantis.122;Начать захват!;;;;;;;;;;;;;x
plot_seize_trade_post_decision_elephant;Использовать Слонов для захвата торговых постов;;;;;;;;;;;;;x
plot_seize_trade_post_decision_elephant_desc;Как член партии Слонов, вы можете использовать полезные связи для захвата торговых постов;;;;;;;;;;;;;x
EVTTOOLTIPvolantis.122;Вы решили предпринять меры против торгового поста при поддержке партии Слонов.;;;;;;;;;;;;;x
EVTDESCvolantis.122;Настало время семье [Root.GetOnlyDynastyName] исполнить план [From.GetPlot]. Партия Слонов поддерживает этот план и, кажется, нам все удастся.;;;;;;;;;;;;;x
TOOLTIPELEPHANTSUNHAPPYWAR;§YПартия Слонов§! недовольна вашим объявлением войны\n;;;;;;;;;;;;;x
opinion_elephant_declared_war;Объявляет агрессивную войну;;;;;;;;;;;;;x
EVTDESCvolantis.1041;Триарх [FromFrom.GetFirstNameWithDynasty] выдвинул предложение объявить войну на заседании Триархов. Триарх [From.GetFirstNameWithDynasty] дал свое одобрение и, при поддержке двух Триархов, война будет объявлена, как и планировалось.;;;;;;;;;;;;;x
show_me_triarchs;Показать Триархов;;;;;;;;;;;;;x
show_me_triarchs_desc;Показать действующих Триархов;;;;;;;;;;;;;x
EVTDESCvolantis.123;[Root.PrimaryTitle.GetFOA], действующими Триархами государства являются...;;;;;;;;;;;;;x
TOOLTIPvolantis.123;Триарх [This.GetFirstNameWithDynasty];;;;;;;;;;;;;x
TOOLTIPvolantis.123TIGER;из партии §RТигров§!\n;;;;;;;;;;;;;x
TOOLTIPvolantis.123ELEPHANT;из партии §BСлонов§!\n;;;;;;;;;;;;;x
TOOLTIPvolantis.123ELECTORATE;В настоящее время §Y[Root.tiger_count.GetValue]§! §RТигриных§! и §Y[Root.elephant_count.GetValue]§! §BСлоновьих§! избирателей в государстве, показывая весь электорат §Y[Root.total_electorate.GetValue]§!\n;;;;;;;;;;;;;x
volantis_switch_party;Сменить партию;;;;;;;;;;;;;x
volantis_switch_party_desc;Переход в противоборствующую партию пошатнет ваше положение в городе.;;;;;;;;;;;;;x
TOOLTIPTIGERSANGRY;Избиратели партии §YТигров§! разозлятся\n;;;;;;;;;;;;;x
TOOLTIPELEPHANTSANGRY;Избиратели партии §YСлонов§! разозлятся\n;;;;;;;;;;;;;x
opinion_betrayed_party;Предательство партии;;;;;;;;;;;;;x
TOOLTIPvolantis.9A;Вы являетесь одним из перебежчиков;;;;;;;;;;;;;x
EVTDESCvolantis.210;Триарх [From.GetFirstNameWithDynasty] скончался раньше, чем прошел срок [From.GetHerHis] полномочий, Вы займете пост Старшего Триарха до следующих выборов.;;;;;;;;;;;;;x
EVTDESCvolantis.220;Триарх [FromFrom.GetFirstNameWithDynasty] скончался прежде, чем срок [FromFrom.GetHerHis] полномочий прошел, и поэтому Триарх [From.GetFirstNameWithDynasty] займет пост Старшего Триарха до следующих выборов.;;;;;;;;;;;;;x
republic_triarch_for_life;Пожизненный Триарх;;;;;;;;;;;;;x
republic_triarch_for_life_option;Пожизненный Триарх;;;;;;;;;;;;;x
republic_triarch_for_life_desc;Если Триарх правит достаточно долго, он может попытаться назначить себя Пожизненным Триархом для избежания лишних ежегодных переизбраний.;;;;;;;;;;;;;x
TOOLTIPrepublic_triarch_for_lifeTRIARCH;По крайней мере один из двух Триархов должны иметь мнение о персонаже [This.GetTitledFirstName] 75 или выше\n;;;;;;;;;;;;;x
TOOLTIPrepublic_triarch_for_life;[This.GetTitledFirstNameWithDynasty] будет провозглашен Пожизненным Триархом, потеряв необходимость ежегодно переизбираться, чтобы удерживать власть.\n;;;;;;;;;;;;;x
opinion_triarch_for_life_1;Провозглашение Пожизненным Триархом;;;;;;;;;;;;;x
opinion_triarch_for_life_2;Провозглашение Пожизненным Триархом;;;;;;;;;;;;;x
EVTOPTBvolantis.1;Я - Пожизненный Триарх, мне не нужно беспокоиться;;;;;;;;;;;;;x
TOOLTIPvolantis.3D;Начинаются долгие дни агитации, и кандидаты на два поста Триархов будут пытаться завоевать голоса\n\n;;;;;;;;;;;;;x
deposed_AGOT;Смещение;;;;;;;;;;;;;x
commission_triarch_statue;Воздвигнуть Статую;;;;;;;;;;;;;x
commission_triarch_statue_desc;Дать приказ о строительстве памятника о Триархии вашей семьи;;;;;;;;;;;;;x
statue_raised;Мастера начинают процесс литья и резьбы статуи.;;;;;;;;;;;;;x
statue_traits;Вы воздвигнете статую в честь самого себя.;;;;;;;;;;;;;x
EVTDESCvolantis.500;Вы решили сделать статую, сделанную в честь вклада Дома [Root.GetOnlyDynastyName] в город в качестве Триархов и лидеров. В честь кого она будет?;;;;;;;;;;;;;x
EVTOPTA_volantis_500;Пусть она станет символом моих триумфов;;;;;;;;;;;;;x
EVTOPTB_volantis_500;Моего отца, это Триарх [Root.Father.GetFirstName];;;;;;;;;;;;;x
EVTDESCvolantis.501;Мастерам, которые будут лить и проводить резьбу, нужно знать еще кое-что. О каких ваших качествах должна упоминать мемориальная доска?;;;;;;;;;;;;;x
EVTOPTA_volantis_501;Ох, я не знаю. Напишите что-нибудь.;;;;;;;;;;;;;x
EVTOPTB_volantis_501;И Вы это спрашиваете у меня!? Вы должны знать!;;;;;;;;;;;;;x
EVTOPTC_volantis_501;Она будет о золотом Арборском, сладком Волантийском, Лисском красном…;;;;;;;;;;;;;x
EVTOPTD_volantis_501;Укажите даты моего пребывания на посту Триарха;;;;;;;;;;;;;x
EVTOPTE_volantis_501;Пусть она покажет, что я был гигантом этого города, несмотря на мой рост.;;;;;;;;;;;;;x
EVTOPTF_volantis_501;О Мудрости, которую я показал людям;;;;;;;;;;;;;x
EVTOPTI_volantis_501;Эм…решайте вы…;;;;;;;;;;;;;x
EVTOPTJ_volantis_501;Надпись должна говорить о том, что у меня была сила десяти воинов!;;;;;;;;;;;;;x
EVTOPTK_volantis_501;О моем знания города и окружающего мира;;;;;;;;;;;;;x
EVTOPTL_volantis_501;Мне неважно что вы напишите, она должна показать моих молящих врагов!;;;;;;;;;;;;;x
EVTOPTM_volantis_501;Должен быть красивый стих, достойный моего правления;;;;;;;;;;;;;x
EVTOPTN_volantis_501;Это не имеет значения, просто убедитесь, что статуя будет хорошо выглядеть внешне.;;;;;;;;;;;;;x
EVTOPTO_volantis_501;Запечатлите все великие пиры, проведенные мной;;;;;;;;;;;;;x
EVTOPTP_volantis_501;Пусть она будет гласить о моей помощи обездоленным города;;;;;;;;;;;;;x
EVTOPTQ_volantis_501;Пусть она будет о моей благосклонности;;;;;;;;;;;;;x
EVTOPTR_volantis_501;Вы упомянете мое величие, великие дела, которые я совершил и…;;;;;;;;;;;;;x
EVTOPTS_volantis_501;Ой, больше и добавить нечего...;;;;;;;;;;;;;x
EVTOPTT_volantis_501;Она будет о том, что мое правление в качестве Триарха было смелым;;;;;;;;;;;;;x
EVTOPTU_volantis_501;Я хочу запомниться народу своими справедливыми решениями.;;;;;;;;;;;;;x
EVTOPTV_volantis_501;Пусть она будет о моей преданности к [Root.Religion.GetRandomGodName];;;;;;;;;;;;;x
EVTOPTX_volantis_501;О моих жестких, но необходимых действиях.;;;;;;;;;;;;;x
EVTNAME_volantis_510;В память Триарха [Root.Father.GetFirstName];;;;;;;;;;;;;x
EVTDESCvolantis.510;Постройка порученной вами статуи, наконец, была закончена, и состоялась торжественная церемония открытия. Вы просматриваете надпись:\n\nЭту статую воздвигнул[Root.GetEndA] [Root.GetTitle] [Root.GetFirstName] в память своего отца, известного как Триарх [Root.Father.GetFirstName] [Root.Father.GetOnlyDynastyName]. Он благородно послужил городу и мирно скончался в своей постели. На веки сохранится эта память.\n\nВы покидаете празднества, убежденные в том, что через много лет, когда статуя потеряет свою предназначенность, жители города вспомнят то великое руководство, которое осуществляла ваша семья.;;;;;;;;;;;;;x
EVTDESCvolantis.511;Постройка порученной вами статуи, наконец, была закончена, и состоялась торжественная церемония открытия. Вы просматриваете надпись:\n\nЭту статую воздвигнул[Root.GetEndA] [Root.GetTitle] [Root.GetFirstName] в память своего отца, известного как Триарх [Root.Father.GetFirstName] [Root.Father.GetOnlyDynastyName]. Он погиб в славной битве, защищая свой город от врагов. Навеки сохранится эта память.\n\nВы покидаете празднества, убежденные в том, что через много лет, когда статуя потеряет свою предназначенность, жители города вспомнят то великое руководство, которое осуществляла ваша семья.;;;;;;;;;;;;;x
EVTDESCvolantis.512;Постройка порученной вами статуи, наконец была закончена, и состоялась торжественная церемония открытия. Вы просматриваете надпись:\n\nЭту статую воздвигнул[Root.GetEndA] [Root.GetTitle] [Root.GetFirstName] в память своего отца, известного как Триарх [Root.Father.GetFirstName] [Root.Father.GetOnlyDynastyName]. Несмотря на его самоотверженное служение, его забрали из этого мира за постыдное достижение. На веки сохранится эта память.\n\nВы покидаете празднества, убежденные в том, что через много лет, когда статуя потеряет свою предназначенность, жители города вспомнят то великое руководство, которое осуществляла ваша семья.;;;;;;;;;;;;;x
EVTDESCvolantis.513;Постройка порученной вами статуи, наконец была закончена, и состоялась торжественная церемония открытия. Вы просматриваете надпись:\n\nЭту статую воздвигнул[Root.GetEndA] [Root.GetTitle] [Root.GetFirstName] в память [Root.GetHerHis] отца Триарха [Root.Father.GetFirstName] [Root.Father.GetOnlyDynastyName]. Этот верный защитник города был отнят у своего народа. И пусть, в один прекрасный день свершится месть\n\nВы покидаете празднества, убежденные в том, что через много лет, когда статуя потеряет свою предназначенность, жители города вспомнят то великое руководство, которое осуществляла ваша семья.;;;;;;;;;;;;;x
EVTDESCvolantis.515;Постройка порученной вами статуи, наконец была закончена, и состоялась торжественная церемония открытия. Вы просматриваете надпись:\n\nЭту статую воздвигнул[Root.GetEndA] [Root.GetTitle] [Root.GetFirstName] в память своего отца, известного как Триарх [Root.Father.GetFirstName] [Root.Father.GetOnlyDynastyName]. С ним произошёл трагический случай, который завершил одно из великих Триаршеств в истории города. На веки сохранится эта память.\n\nВы покидаете празднества, убеждённые в том, что через много лет, когда статуя потеряет свою предназначенность, жители города вспомнят то великое руководство, которое осуществляла ваша семья.;;;;;;;;;;;;;x
EVTDESCvolantis.516;Постройка порученной вами статуи, наконец была закончена, и состоялась торжественная церемония открытия. Вы просматриваете надпись:\n\nЭту статую воздвигнул[Root.GetEndA] [Root.GetTitle] [Root.GetFirstName] в память своего отца, известного как Триарх [Root.Father.GetFirstName] [Root.Father.GetOnlyDynastyName]. Наиспособнейший лидер понёс бесчестную смерть в плену своих врагов. На веки сохранится эта память.\n\nВы покидаете празднества, убежденные в том, что через много лет, когда статуя потеряет свою предназначенность, жители города вспомнят то великое руководство, которое осуществляла ваша семья.;;;;;;;;;;;;;x
EVTDESCvolantis.517;Постройка порученной вами статуи, наконец была закончена, и состоялась торжественная церемония открытия. Вы просматриваете надпись:\n\nЭту статую воздвигнул[Root.GetEndA] [Root.GetTitle] [Root.GetFirstName] в память своего отца, известного как Триарх [Root.Father.GetFirstName] [Root.Father.GetOnlyDynastyName]. Этот благородный Триарх города был принесён в жертву богу дикарей. На веки сохранится эта память.\n\nВы покидаете празднества, убежденные в том, что через много лет, когда статуя потеряет свою предназначенность, жители города вспомнят то великое руководство, которое осуществляла ваша семья.;;;;;;;;;;;;;x
EVTDESCvolantis.518;Постройка порученной вами статуи, наконец была закончена, и состоялась торжественная церемония открытия. Вы просматриваете надпись:\n\nЭту статую воздвигнул[Root.GetEndA] [Root.GetTitle] [Root.GetFirstName] в память своего отца, известного как Триарх [Root.Father.GetFirstName] [Root.Father.GetOnlyDynastyName]. Он пал в поединке, отстаивая традиции города, как один из лучших его Триархов. На веки сохранится эта память.\n\nВы покидаете празднества, убежденные в том, что через много лет, когда статуя потеряет свою предназначенность, жители города вспомнят то великое руководство, которое осуществляла ваша семья.;;;;;;;;;;;;;x
EVTDESCvolantis.519;Постройка порученной вами статуи, наконец была закончена, и состоялась торжественная церемония открытия. Вы просматриваете надпись:\n\nЭту статую воздвигнул[Root.GetEndA] [Root.GetTitle] [Root.GetFirstName] в память своего отца, известного как Триарх [Root.Father.GetFirstName] [Root.Father.GetOnlyDynastyName]. Его преданность городу, переполняла его, что привело к его смерти от собственной руки. Пусть [Root.Religion.GetRandomGodName] дарует ему покой.\n\nВы покидаете празднества, убежденные в том, что через много лет, когда статуя потеряет свою предназначенность, жители города вспомнят то великое руководство, которое осуществляла ваша семья.;;;;;;;;;;;;;x
EVTDESCvolantis.520;Постройка порученной вами статуи, наконец была закончена, и состоялась торжественная церемония открытия. Вы просматриваете надпись:\n\nЭту статую воздвигнул[Root.GetEndA] [Root.GetTitle] [Root.GetFirstName] в память своего отца, известного как Триарх [Root.Father.GetFirstName] [Root.Father.GetOnlyDynastyName]. Люди этого прекрасного города любили и уважали этого человека как и его преданн[Root.GetAyaYy] [Root.GetSonDaughter] [Root.GetFirstName]. Вы покидаете празднества, убежденные в том, что через много лет, когда статуя потеряет свою предназначенность, жители города вспомнят то великое руководство, которое осуществляла ваша семья.;;;;;;;;;;;;;x
