#CODE;ENGLISH;;;;;;;;;;;;;x
EVTOPTA_volantis_573;Сволочи!;;;;;;;;;;;;;x
EVTDESCvolantis.574;Как только Триарх [From.GetFirstNameWithDynasty] умирает, для многих [From.GetHerHis] смерть стала праздником. Многие жители вышли на улицы, их главной целью была статуя, отмечающая [From.GetHerHis] Триаршество. Толпа обезглавила её и бросила голову в реку.;;;;;;;;;;;;;x
EVTOPTA_volantis_574;Кажется, [From.GetSheHe] обр[From.GetLaYol] множество врагов;;;;;;;;;;;;;x
EVTDESCvolantis.575;Ваше правление как Триарха не закончилось мирным путём. Вы были вынуждены покинуть свой пост против вашей воли. Теперь ваши враги поощряют население города выходить на улицы и праздновать, а также организовали разгневанную толпу, чтобы изуродовать и обезглавить вашу статую, посвященную вашему правлению в качестве Триарха.;;;;;;;;;;;;;x
EVTOPTA_volantis_575;Позор.;;;;;;;;;;;;;x
EVTDESCvolantis.577;[From.GetFirstNameWithDynasty] и [From.GetHerHis] дом, давно являются моими врагами. Они обесчестивали Дом [Root.GetOnlyDynastyName] на каждом шагу. Возможно стоит нанять банду головорезов, чтобы испортить статую одного из [From.GetHerHis] предков Триархов, чтобы исправить эти ошибки?;;;;;;;;;;;;;x
EVTOPTA_volantis_577;Да, обезглавьте и испоганьте!;;;;;;;;;;;;;x
EVTOPTB_volantis_577;Нет,я не опущусь до такого уровня;;;;;;;;;;;;;x
EVTDESCvolantis.578;[From.GetFirstNameWithDynasty] имеет давнюю ненависть ко мне и моему Дому. [From.GetSheHeCap] нанимает головорезов, чтобы они напали на статую моего предка-Триарха. Они испортили её, перед тем как обезглавить.;;;;;;;;;;;;;x
EVTOPTA_volantis_578;Я отомщу за это!;;;;;;;;;;;;;x
elected_triarch_1;Новоизбранный Триарх;;;;;;;;;;;;;x
elected_triarch_2;Новоизбранный Триарх;;;;;;;;;;;;;x
TOOLTIPvolantisvotecountA;Вы получили §Y[Root.election_votes.GetValue]§! голосов\n;;;;;;;;;;;;;x
TOOLTIPvolantisvotecountB;[From.GetTitledFirstName] получает §Y[From.election_votes.GetValue]§! голосов\n;;;;;;;;;;;;;x
triarch_imprison;Заключить в тюрьму (Триарх);;;;;;;;;;;;;x
triarch_imprison_desc;Вы можете использовать свои возможности Триарха, чтобы попытаться заключить в тюрьму персонажа [Root.GetTitledFirstName]. Вам понадобится согласие вашего младшего Триарха, чтобы сделать это.;;;;;;;;;;;;;x
TOOLTIPtriarch_imprisonPROGRESS;В настоящее время НЕ пытается заключить кого-то в тюрьму\n;;;;;;;;;;;;;x
TOOLTIPtriarch_imprisonTRIARCH;НЕ Триарх\n;;;;;;;;;;;;;x
TOOLTIPtriarch_imprisonREJECTED;[From.GetTitledFirstName] НЕ пытается/проваливает попытку заключить персонажа [Root.GetFirstNameWithDynasty] в прошлом году\n;;;;;;;;;;;;;x
TOOLTIPvolantis.130;Триарх [This.GetFirstNameWithDynasty] рассмотрит ваше предложение о заключении в тюрьму персонажа [Root.GetFirstNameWithDynasty].;;;;;;;;;;;;;x
TOOLTIPtriarch_imprisonCHANCE;Так, если ваш младший Триарх согласится, [Root.GetFirstNameWithDynasty] окажется в тюрьме. Старший Триарх будет заниматься арбитражем.;;;;;;;;;;;;;x
EVTDESCvolantis.130;Ваш собрат Триарх, [FromFrom.GetFirstNameWithDynasty], говорит с вами наедине перед встречей Триаршества. [FromFrom.GetSheHeCap] говорит, что [FromFrom.GetSheHe] желает увидеть, как [From.GetTitledFirstNameWithDynasty] будет арестован[From.GetEndA], и просит вашей поддержки. Вкупе с вашим влиянием, [From.GetTitledFirstName] может быть заключен[From.GetEndA] под стражу законно.;;;;;;;;;;;;;x
EVTOPTAvolantis.130;Да, я думаю, это пошло бы всем на руку;;;;;;;;;;;;;x
TOOLTIPvolantis.135;Если арест не удастся, старшего Триарха оставят для разбирательств\n;;;;;;;;;;;;;x
EVTOPTBvolantis.130;Нет, я не вижу причин для этого.;;;;;;;;;;;;;x
TOOLTIPvolantis.134;узнаёт;;;;;;;;;;;;;x
EVTDESCvolantis.131;После встречи Триаршества города, вы были шокированы, узнав, что на ваш арест был выдан ордер! Очевидно, Триархи [From.GetFirstNameWithDynasty] и [FromFromFrom.GetFirstNameWithDynasty] сговорились использовать свою общую власть, чтобы законно заключить вас в тюрьму. Их люди арестовали вас, прежде чем вы смогли что-либо предпринять.;;;;;;;;;;;;;x
EVTOPTAvolantis.131;Это тирания!;;;;;;;;;;;;;x
EVTDESCvolantis.132;На встрече Триархии вы были удивлены, услышав, что Триарх [FromFromFrom.GetFirstNameWithDynasty] предлагает арестовать Триарха, известного как [FromFrom.GetTitledFirstNameWithDynasty]. Когда Триарх [From.GetFirstNameWithDynasty] быстро соглашается, у вас не было другого выбора, кроме как утвердить ордер на [FromFrom.GetHerHis] арест. [FromFrom.GetTitledFirstName] был[FromFrom.GetEndA] задержан[FromFrom.GetEndA] в течение нескольких часов.;;;;;;;;;;;;;x
EVTOPTAvolantis.132;Их совместная власть не оставила мне выбора;;;;;;;;;;;;;x
EVTDESCvolantis.133;Перед встречей Триархии, вы сумели убедить Триарха, известного как [From.GetFirstNameWithDynasty] согласиться с вашим предложением. Вы использовали ваше общее влияние для выдачи ордера на арест Триараха [FromFrom.GetTitledFirstNameWithDynasty], который был исполнен в течении нескольких часов до того, как [FromFrom.GetSheHe] что-то предпринимает.;;;;;;;;;;;;;x
EVTOPTAvolantis.133;[FromFrom.GetSheHeCap] теперь у меня в заключении;;;;;;;;;;;;;x
EVTDESCvolantis.134;Вы обратились к Триарху [From.GetFirstNameWithDynasty] с просьбой о [From.GetHerHis] поддержке в аресте персонажа [FromFrom.GetTitledFirstNameWithDynasty]. [From.GetSheHeCap] отказывается помочь вам, оставив вас без права выдавать ордер.;;;;;;;;;;;;;x
EVTOPTAvolantis.134;Нужно найти другой путь;;;;;;;;;;;;;x
EVTDESCvolantis.135;После встречи Триаршества города, вы были шокированы, узнав, что на ваш арест был выдан ордер! Очевидно, Триархи [From.GetFirstNameWithDynasty] и [FromFromFrom.GetFirstNameWithDynasty] сговорились использовать свою общую власть, чтобы законно заключить вас в тюрьму. Однако прежде чем их агенты поймали вас, вы забаррикадировались в своём имении.;;;;;;;;;;;;;x
EVTOPTAvolantis.135;Убежать!!!;;;;;;;;;;;;;x
EVTOPTCvolantis.135;Им придется насильно вытаскивать меня!;;;;;;;;;;;;;x
EVTOPTDvolantis.135;Я самолично сдаюсь старшему Триарху;;;;;;;;;;;;;x
TOOLTIPvolantis.137;[This.GetFirstNameWithDynasty], старший Триарх, может решить арестовать вас с применением силы;;;;;;;;;;;;;x
EVTDESCvolantis.136;Перед встречей Триархии вы и Триарх [FromFrom.GetFirstNameWithDynasty] пришли к соглашению. Вы использовали вашу общее влияние для выдачи ордера на арест персонажа [From.GetTitledFirstNameWithDynasty]. Однако, [From.GetSheHe] избегает ареста и впоследствии покидает город.;;;;;;;;;;;;;x
EVTDESCvolantis.136B;Перед встречей Триархии вы и Триарх [FromFromFromFrom.GetFirstNameWithDynasty] пришли к соглашению. Вы использовали вашу общее влияние для выдачи ордера на арест персонажа [From.GetTitledFirstNameWithDynasty]. Однако, [From.GetSheHe] избежает ареста и впоследствии покидает город.;;;;;;;;;;;;;x
EVTOPTAvolantis.136;Очевидно, слишком трусливы, чтобы предстать перед правосудием;;;;;;;;;;;;;x
EVTDESCvolantis.137;На встрече Триархии вы были удивлены, услышав предложение Триарха [FromFromFromFrom.GetFirstNameWithDynasty] о том, чтобы арестовать Триарха [From.GetTitledFirstNameWithDynasty]. Когда Триарх [FromFrom.GetFirstNameWithDynasty] быстро соглашается, у вас не было другого выбора, кроме как утвердить ордер на [FromFrom.GetHerHis] арест. [From.GetTitledFirstName] избегает ареста и баррикадируется в  своём имении. Теперь вам нужно обеспечить соблюдение закона.;;;;;;;;;;;;;x
EVTOPTAvolantis.137;Я выкорчую [From.GetHerHis] оттуда силой!;;;;;;;;;;;;;x
EVTOPTBvolantis.137;Это не моя борьба;;;;;;;;;;;;;x
EVTDESCvolantis.138;Триарх [From.GetFirstNameWithDynasty] решает исполнить ордер Триарха и поднимает силы против меня!;;;;;;;;;;;;;x
EVTOPTAvolantis.138;Достань меня!;;;;;;;;;;;;;x
EVTDESCvolantis.139;Перед встречей Триархии вы и Триарх [FromFromFrom.GetFirstNameWithDynasty] пришли к соглашению. Вы использовали ваше общее влияние, для выдачи ордера на арест персонажа [FromFrom.GetTitledFirstNameWithDynasty]. Однако, [FromFrom.GetSheHe] избегает ареста, забаррикадировавшись в своём имении. Вследствие этого [From.GetFirstNameWithDynasty], старший Триарх, разумно принимает решение вмешаться и добиться ареста, применив силу;;;;;;;;;;;;;x
EVTDESCvolantis.139B;Перед встречей Триархии вы и ваш младший Триарх пришли к соглашению. Вы использовали ваше общее влияние, для выдачи ордера на арест Триарха [FromFrom.GetTitledFirstNameWithDynasty]. Однако, [FromFrom.GetSheHe] избегает ареста, забаррикадировавшись в своём имении. Вследствие этого, [From.GetFirstNameWithDynasty], старший Триарх, разумно принимает решение вмешаться и добиться ареста, применив силу.;;;;;;;;;;;;;x
weak_triarch;Слабый Триарх;;;;;;;;;;;;;x
EVTOPTAvolantis.139;[FromFrom.GetSheHeCap] будет сожалеть о сопротивлении нам;;;;;;;;;;;;;x
EVTDESCvolantis.140;Триарх [From.GetFirstNameWithDynasty] проявляет слабость, так как [From.GetSheHe] решает не выдавать ордер на ваш арест.;;;;;;;;;;;;;x
EVTOPTAvolantis.140;[From.GetSheHeCap] поступает разумно, не идя против меня;;;;;;;;;;;;;x
EVTDESCvolantis.144;Перед встречей Триархии вы и Триарх [FromFromFrom.GetFirstNameWithDynasty] пришли к соглашению. Вы использовали ваше общее влияние для выдачи ордера на арест персонажа [FromFrom.GetTitledFirstNameWithDynasty]. Однако [FromFrom.GetSheHe] избегает ареста, забаррикадировавшись в своёи имении. [From.GetFirstNameWithDynasty], старший Триарх, долж[From.GetNaEn] был[From.GetEndA] обязан[From.GetEndA] исполнить ордер. Однако [From.GetSheHeCap] проявляет слабость и предпочитает не исполнять нашу волю.;;;;;;;;;;;;;x
EVTDESCvolantis.144B;Перед встречей Триархии вы и ваш младший Триарх пришли к соглашению. Вы использовали ваше общее влияние для выдачи ордера на арест персонажа [FromFrom.GetTitledFirstNameWithDynasty]. Однако [FromFrom.GetSheHe] избегает ареста, забаррикадировавшись в своём имении. [From.GetFirstNameWithDynasty], старший Триарх,долж[From.GetNaEn] был[From.GetEndA] обязан[From.GetEndA] исполнить ордер. Однако [From.GetSheHeCap] проявляет слабость и предпоитает не исполнять нашу волю.;;;;;;;;;;;;;x
EVTOPTAvolantis.144;Слабый и несправедливый поступок;;;;;;;;;;;;;x
EVTDESCvolantis.142;На встрече Триархии вы были удивлены, услышав предложение Триарха [FromFromFromFrom.GetFirstNameWithDynasty] о том, чтобы арестовать Триарха [From.GetTitledFirstNameWithDynasty]. Когда Триарх [FromFrom.GetFirstNameWithDynasty] быстро соглашается, у вас не было другого выбора, кроме как утвердить ордер на [FromFrom.GetHerHis] арест. Однако [From.GetTitledFirstName] избегает ареста и решает лично придти к вам и сдаться.;;;;;;;;;;;;;x
EVTOPTAvolantis.142;Разумно, я, безусловно, буду относиться к н[From.GetHerHim] более благородно;;;;;;;;;;;;;x
EVTDESCvolantis.143;Перед встречей Триархии вы и Триарх [FromFromFrom.GetFirstNameWithDynasty] пришли к соглашению. Вы использовали ваше общее влияние для выдачи ордера на арест Триарха [FromFrom.GetTitledFirstNameWithDynasty]. Однако [FromFrom.GetSheHe] избегает ареста и решает лично сдаться Триарху [From.GetFirstNameWithDynasty];;;;;;;;;;;;;x
EVTDESCvolantis.143B;Перед встречей Триархии вы и Триарх пришли к соглашению. Вы использовали ваше общее влияние для выдачи ордера на арест Триарха [FromFrom.GetTitledFirstNameWithDynasty]. Однако [FromFrom.GetSheHe]  избегает ареста и решил лично сдаться Триарху [From.GetFirstNameWithDynasty];;;;;;;;;;;;;x
EVTOPTAvolantis.143;По крайней мере, [FromFrom.GetSheHe] находится в плену;;;;;;;;;;;;;x
opinion_triarch_imprisonment_agreed;Соглашается на заключение;;;;;;;;;;;;;x
opinion_triarch_imprisoned_me;Триарх заключает меня в тюрьму;;;;;;;;;;;;;x
opinion_triarch_did_not_imprison_me;Триарх не заключает меня в тюрьму;;;;;;;;;;;;;x
opinion_triarch_imprison_reject;Игнорирует ордер Триархов на арест;;;;;;;;;;;;;x
grant_freehold;Предоставить Фригольд;;;;;;;;;;;;;x
grant_freehold_desc;[Root.GetTitledFirstNameWithDynasty] получит Фригольд, что позволит им принимать участие в выборах.;;;;;;;;;;;;;x
revoke_freehold;Отобрать Фригольд;;;;;;;;;;;;;x
revoke_freehold_desc;Отобрать Фригольд у человека, известного как [Root.GetTitledFirstNameWithDynasty], забрав всё имущество и земли. После этого [Root.GetSheHe] не сможет голосовать на выборах.;;;;;;;;;;;;;x
title_triarch_for_life;Пожизненный Триарх;;;;;;;;;;;;;x
name_co_triarch_for_life;Провозгласить пожизненно Сотриарха;;;;;;;;;;;;;x
name_co_triarch_for_life_named;Провозгласить, что [Root.GetTitledFirstName] - пожизненный Сотриарх;;;;;;;;;;;;;x
name_co_triarch_for_life_desc;[Root.GetTitledFirstName], ваш наследник династии, может быть провозглашен пожизненным Сотриархом, чтобы править вместе с вам. Это обеспечит продолжение правления Дома [Root.GetOnlyDynastyName] над государством [Root.PrimaryTitle.GetName] и позволит избежать неудобств выборов.;;;;;;;;;;;;;x
opinion_named_me_co_triarch_for_life;Назначает меня пожизненным Сотриархом;;;;;;;;;;;;;x
TOOLTIPname_co_triarch_for_lifeREALM;Государственные члены фракции будут расстроены\n;;;;;;;;;;;;;x
opinion_co_triarch_for_life;Провозглашает Пожизненного Сотриарха;;;;;;;;;;;;;x
EVTDESCvolantis.260;Не довольствуясь только собственным титулом Триарха, [FromFrom.GetTitledFirstNameWithDynasty] провозглашает своего наследника, известного как [From.GetTitledFirstName], пожизненным Сотриархом. Это обеспечит правление династии [FromFrom.GetOnlyDynastyName] над государством [FromFrom.PrimaryTitle.GetName] в будущем.;;;;;;;;;;;;;x
EVTOPTAvolantis.260;Некоторые скажут, что их нужно избирать;;;;;;;;;;;;;x
EVTOPTBvolantis.260;[From.GetFirstName] когда-нибудь будет править на моем месте;;;;;;;;;;;;;x
EVTOPTCvolantis.260;Это льстит;;;;;;;;;;;;;x
EVTDESCvolantis.270;Поскольку вы были неспособны править как Триарх самостоятельно, один из младших Триархов станет регентом.;;;;;;;;;;;;;x
TOOLTIPtitle_patrician_heirNOTTRIARCHFORLIFE;НЕ пожизненный Триарх;;;;;;;;;;;;;x
triarch_economy_project;Проект 'Маленький слон';;;;;;;;;;;;;x
triarch_military_project;Проект 'Маленький тигр';;;;;;;;;;;;;x
EVTOPTCvolantis.118;Я могу позволить себе только небольшой проект;;;;;;;;;;;;;x
